|Unique_transcript_id|Date|Company_name|Word_count|Text
5|2386930.0|2005-11-17 22:00:00|Autodesk, Inc.|2500|"Good day, ladies and gentlemen, and welcome to the third quarter 2007 Autodesk financial results conference call. My name is Sam, and I will be your operator for today. At this time, all participants are in a listen-only mode. We will conduct a question-and-answer session towards the end of this conference. [Operator Instructions].
As a reminder, this call is being recorded for replay purposes. I would now like to turn the call over to Ms. Sue Pirri, Vice President of Investor Relations. Please proceed.
 
Thanks, operator. Good afternoon everyone. Thank you for joining us today, as we report results for our third quarter of fiscal 2007. With me today are Carl Bass and Al Castino.
Today's conference call is being broadcast live through an audio webcast. In addition, a replay of the call will be available via webcast on our website, ""www.autodesk.com/investor.""
During the course of this conference call, we will make forward-looking statements regarding future events and the future performance of the Company, including our guidance for the fourth fiscal quarter and the fiscal years 2007 and 2008, the factors we use to estimate our guidance for those periods, our competitive position, our future business prospects and revenue growth, our market opportunities, and trends for our products in various geographies. We caution you that such statements reflect our best judgment based on factors currently known to us and that actual events or results could differ materially.
Please refer to the documents we file from time to time with the SEC, and specifically our 10-K for fiscal 2002, our 10-Q for the quarter ended April 30th 2006, and our periodic 8-K filings, including the 8-K filed with today's press release. These documents contain and identify important risks and other factors that may cause the actual results to differ from those contained in our forward-looking statements.
In adherence to regulation Fair Disclosure, Autodesk will provide quarterly information and forward-looking guidance in its quarterly financial results press release and this publicly announced financial results conference call. We will not provide any further guidance or updates on our performance during the quarter, unless we do so in a public forum.
Autodesk does not assume any obligation to update the forward-looking statements provided to reflect events that occur or circumstances that exist after the date on which they were made.
Now, I'd like to turn the call over to Carl Bass.
 
Good afternoon and thank you for joining us. Today, Autodesk reported another quarter of very good financial performance. Quarterly revenue was a record $457 million, a 21% increase over last year.
Spending on total costs and expenses was in line with our projections in the quarter, increasing $10 million sequentially, before taking into account expenses resulting from the voluntary stock option review. And once again, we achieved record quarterly results on many of our most important business metrics, including 3D revenue, subscription revenue, and revenue from emerging economies.
Before we get started, I would like to remind you that like many companies, Autodesk has undertaken a voluntary review of our past stock option granting practices. We will not provide the interim results of the review. Similarly, we will provide final earnings results, once the review is complete.
Now, let's talk about the quarter. Customer demand for Autodesk products was robust this quarter. Compared to last year, revenue from new seats increased 20%. Revenue from new seats of Revit and Civil 3D continued to be exceptional, increasing 94% and 44%, respectively, compared to last year.
Revenue from new seats of AutoCAD Mechanical and AutoCAD were also robust, increasing 57% and 24%, respectively, compared to last year. In addition, one of our emerging businesses showed particular strength this quarter. Revenue from Buzzsaw, our hosted collaboration service for the Building industry, increased 79% over last year.
Once again, sales from new seats and emerging businesses were approximately two-thirds of total revenue in the quarter. This continues to be an indicator of the underlying strength of our business.
Our 3D solutions, Inventor, Revit and Civil 3D, continued to gain market share, as customers across all industries recognize the benefits of adopting model-based design. Total 3D revenue increased 36% over the third quarter of last year to $98 million. We shipped more than 38,000 commercial seats of our 3D products.
Our Revit family of products had outstanding performance, again. Quarterly revenues increased 98% over last year, and we shipped 18,200 commercial seats. Civil 3D had terrific performance in the quarter, growing 57% over last year, and we shipped 6,900 commercial seats. Inventor revenue increased 12% compared to last year and 7% sequentially.
Japan continues to be a source of weakness for Inventor, where revenues again declined compared to last year. Inventor revenue increased 15% in EMEA and 26% in the Americas. In total, we shipped 13,000 commercial seats of Inventor in the quarter. We continue to win market share, as the boundaries erode between mainstream solutions, such as Inventor, and overpriced legacy offerings.
Our model-based 3D products already represent 22% of total revenue, and we are still in the early stages of penetrating our large installed base of 2D users as well as increasing our market share by converting users of competitive legacy systems. We estimate that approximately 10% of our growing 2D base has added 3D, leaving significant opportunity for future growth.
Emerging economies continue to be an area of very strong performance for us. Quarterly revenue in emerging economies increased 38% over last year and now represents 15% of total quarterly revenues.
Subscriptions showed terrific performance in the third quarter. Driven by strong attach and renewal rates, subscription revenue reached $111 million, an increase of 50% compared to the third quarter of last year. Subscriptions now represent 24% of total revenues. Deferred subscription revenue increased $12 million sequentially to $275 million.
Consistent with the large increase in subscriptions, upgrade revenue decreased in the quarter, as expected. Combined revenues from subscription and upgrades in the third quarter increased 17% over last year to $162 million, representing approximately one-third of total quarterly revenue.
Quarterly revenue from our Media and Entertainment segment grew 50% over last year. Our animation business grew 14% sequentially and nearly 160% over last year to $33 million. New versions of Max and Maya were launched at the end of the second quarter, and customer feedback on both products is terrific.
Revenues from 3ds Max increased 28% over last year. And Maya had its best quarter ever, increasing revenue 33% sequentially. As our results show, the integration of Alias is complete, and the animation business is soundly on track. We are looking forward to strong results in the future.
Advanced Systems revenue increased 5%, both sequentially and over last year. Our customers continue to transition away from proprietary high-end SGI workstations to Linux-based solutions running on standard PCs. Revenue from our Linux-based solutions was strong in the quarter. In fact, once again, more than 80% of systems product revenue was Linux-based this quarter.
While we don't believe this transition is complete, we are very encouraged by these results. Overall, I'm very pleased with our financial performance this quarter. Now, I'd like to turn the call over to Al for a review of our financials.
 
And thanks, Carl. Once again, Autodesk delivered great performance. As Carl said, net revenues in the quarter were $457 million, 21% higher than last year. Each of our geographies grew substantially compared to the third quarter of last year.
Revenue in the Americas was $194 million, an increase of 21%. EMEA revenues were $160 million, an increase of 20% as reported and 14% constant currency. And Asia Pacific increased 22% to $103 million. Revenues in Japan increased 3% compared to last year. Excluding Japan, revenues in Asia Pacific increased 36% compared to last year.
Looking at the divisions. Platform Technology revenue decreased 9% over the third quarter of last year to $197 million. Growth in PTDs was led by a 24% increase in AutoCAD new seat revenue and a 29% increase in AutoCAD subscription revenue.
As planned, upgrades of AutoCAD decreased 40% compared to last year. Revenue from AutoCAD LT was approximately flat with last year, due to weakness in Japan and the timing and type of promotional activity.
Manufacturing Solutions revenue was $85 million, an increase of 34% over last year. As Carl mentioned, AutoCAD Mechanical had a terrific quarter, increasing revenues 33% over last year. In total, we shipped more than 93,000 seats to our users in the manufacturing market.
Revenue for Building Solutions increased 28% over last year to $58 million. Revenues from Revit increased 98% compared to last year. Revenues from Architectural Desktop, our vertical solution for architects, were approximately flat compared to last year, as customers are increasingly moving to our Revit platform.
Infrastructure Solutions revenue increased 14% over last year to $50 million. As in the Building industry, strong adoption of our 3D products is impacting growth rates for our vertical 2D products. While revenues from Land Desktop decreased compared to last year, revenue from Civil 3D increased by 57%.
And as Carl mentioned, Media and Entertainment had a very strong quarter with revenue of $64 million, an increase of 50% over last year and 10% sequentially, driven by growth in our animation products, 3ds Max and Maya.
As we have said, because we're in the process of completing the stock option review, we will not provide EPS. However, we can tell you that our spending for total costs and expenses, which include cost of license and other revenue, cost of maintenance revenue, marketing and sales, research and development, and general and administrative, increased by $10 million sequentially as expected.
This increase does not take into account expenses resulting from the voluntary stock option review. This increase does include a $3-million write-down of Advanced Systems' inventory. As a result of this write-off, gross margins decreased 1 percentage point, both sequentially and compared to the third quarter of fiscal 2006.
In addition to the $10 million increase I just mentioned, we spent approximately $3.6 million on legal, tax and accounting fees related to the voluntary review of our stock option grant practices and paid a onetime bonus of $8.8 million to the non-executive employees who were enrolled in the employee stock purchase plan.
This bonus was approved by the Board to compensate for the benefits lost by non-executive employees, because Autodesk was legally precluded from issuing shares to the employee stock purchase plan due to the ongoing review.
Interest and other income increased by $3 million sequentially to $6 million, partially due to higher interest rates and increasing cash balances as well as reimbursement of an escrow amounts related to a prior acquisition.
Compared to last year, foreign currency impact was $6 million favorable on revenues and immaterial on expenses. Compared to the second quarter, foreign currency impact was $2 million favorable on revenue and $2 million unfavorable on expenses.
Total deferred revenues were $333 million, including $49 million classified as long-term. Deferred subscription revenues were $275 million, an increase of $12 million sequentially and $90 million over the third quarter of last year.
Total backlog, including deferred revenue, increased to $352 million. This included product backlog of $19 million. Channel inventory was slightly below our normal range of three to four weeks. DSO decreased 1 day from last quarter to 51 days.
Capital expenditures were $7 million in the quarter. Cash and investments increased $129 million sequentially to $597 million, because we were not able to repurchase shares during the quarter pending the resolution of the stock option review.
During the quarter, we received $10 million from employee stock plans. There were approximately 231 million total shares outstanding and 242 million fully diluted shares. We had a very strong third quarter. Now, I'll turn to guidance.
As usual, our guidance takes into account today's foreign exchange rates, including some level of buffer against future strengthening of the dollar. Because of our ongoing voluntary stock option review, I'm not going to provide EPS guidance.
Net revenues for the fourth quarter of fiscal 2007 are expected to be between $490 million and $500 million. We expect spending for total costs and expenses in the fourth quarter to be approximately flat with the third quarter.
Estimates of fourth quarter spending for total costs and expenses include approximately $5 million in legal, tax and accounting fees related to the voluntary stock option review and do not take into account other charges, if any, resulting from the voluntary stock option review.
For fiscal 2007, we are now expecting revenue in the range of $1.832 billion to $1.842 billion. Now, looking at fiscal 2008, based upon the best information that we have today, we are first providing preliminary guidance for the first quarter and full year.
For fiscal year 2008, net revenues are expected to be between $2.075 billion and $2.125 billion. Operating margins for the year are expected to increase 3 to 4 percentage points excluding expenses, if any, resulting from the voluntary stock option review.
Operating margins from fiscal 2008 are expected to increase 1 to 1.5 percentage points, not taking into account estimated FAS 123(R) stock-based compensation expenses, amortization of acquisition-related intangibles, litigation accruals, legal tax and accounting fees, if any, and charges, if any, resulting from the voluntary stock option review.
Net revenues for the first quarter of 2008 are expected to be approximately flat with the fourth quarter of fiscal 2007. Consistent with normal seasonal trends, we expect spending for total costs and expenses for the first quarter of fiscal 2008 to increase approximately $10 million sequentially.
Estimates of spending do not take into account legal, tax and accounting fees, if any, or any other charges, if any, resulting from the voluntary stock option review. Now, let me turn it back to Carl 
 
Thanks, Al. Before we take questions, I'd like to summarize a few key thoughts. Once again, Autodesk had very strong financial results. We continue to win share in all of our key markets. We achieved record results from many of our key metrics including 3D revenue and revenues from our subscription program.
The Americas and the emerging economies reported their best quarters ever, but the modest growth we saw in Japan was not up to our expectations and we continue to focus on improving our performance in this key economy. Adoption of our model based 3D solutions is increasing worldwide and growth in our 2D solutions remains robust. Remember that our strong 2D growth fuels our 3D opportunity. 
Excluding the cost of the voluntary stock option review, our profitability continues to exceed our expectations. We remain committed to optimizing revenue growth and profitability.
And finally, we remain very confident of our growth opportunities. While there are currently a number of mixed signals about the overall health of the economy, customer demand for our products remains very strong. The innovation and productivity enabled by Autodesk solution provide our customers with a real competitive advantage they need in every economy.
Operator, we're ready for questions.
"
