|Unique_transcript_id|Date|Company_name|Word_count|Text
0|1686626.0|2005-06-21 14:00:00|The Kroger Co.|2557|"Good morning, ladies and gentlemen and welcome to the first quarter 2006 Kroger Company’s earnings conference call. 
My name is Janelle and I will be your audio coordinator for today. (Operator Instructions). I would now like to turn the presentation over to your host for today, Ms. Carin Fike. Please proceed, ma’am.
 
Thanks, and thank you for joining us. Before we begin, I want to remind you that today’s discussion will include forward-looking statements. We want to caution you that such statements are predictions and actual events or results can differ materially. A detailed discussion of the many factors that we believe may have a material effect on our business on an ongoing basis is contained in our SEC filings, but Kroger assumes no obligation to update that information.
Both our first quarter press release and our prepared remarks from this conference call will be available on our website at www.kroger.com.
Now I will turn the call over to Mr. Dillon.
 
Thanks, Carin and good morning, everyone. We are pleased you could join us to review Kroger’s first quarter financial results. With me today are Rodney McMullen, Kroger’s Vice-Chairman; Don McGeorge, Kroger’s President and Chief Operating Officer; and Mike Schlotman, Senior Vice-President and Chief Financial Officer.
I’d like to begin this morning by briefly reviewing Kroger’s first quarter financial performance and then I’ll provide an update on Kroger’s outlook for 2006. Rodney will share additional details about our first quarter results and then we’ll be happy to take your questions.
Kroger’s associates continue to focus on delivering improved service, selection and value to our customers. This is translated into another quarter of impressive sales growth. Total sales for the first quarter increased 8.2% to $19.4 billion. This growth continues to be broad based across all divisions and all store departments. Growth was particularly strong in grocery, produce, natural food and fuel. Our convenience stores also had a very strong quarter not only in fuel, but in non-fuel merchandise as well. 
Identical supermarket sales increased 7.2% with fuel, and 5.6% without fuel. Once again, by either measure, this represents Kroger’s highest identical supermarket sales since the merger with Fred Meyer in 1999. It is also the 11th consecutive quarter of positive identical supermarket sales excluding fuel. We are extremely pleased by this performance and believe it compares very favorably to our traditional supermarket competition and indeed, just about every other retail competitor.
Net earnings were $306.4 million, or $0.42 per diluted share, for the first quarter. Net earnings in the year ago period were $294.3 million, or $0.40 per diluted share. Rodney will discuss two items that, together, affected our first quarter earnings by $0.05 per diluted share in the current year. After adjusting for these items, because they did not have a comparable impact on the prior year, you’ll see that Kroger had a very strong quarter. 
It was also another quarter that demonstrated the balance that Kroger’s strategic plan requires among several elements, including: sales, earnings, cost control and capital investment. We continue to believe this strategy is the appropriate path to build sustainable earnings growth and long term value for our shareholders. 
Turning now to some comments on 2006 guidance. You may recall that we originally forecasted identical supermarket sales growth, excluding fuel sales, in excess of 3.5% for fiscal 2006. Today we are raising our sales guidance. Kroger now expects identical supermarket sales growth, excluding fuel sales, to exceed 4% for the balance of the year; or approximately 4.5% for the full year.
This updated sales guidance reflects the momentum of our first quarter performance as well as opportunities we have identified for additional growth. It is tempered by the difficulty in forecasting additional sales growth in markets that experience unexpected increases as a result of hurricanes Katrina and Rita during the second half of 2005. Even so, the entire Kroger organization is still very focused on driving improvement in identical sales growth. As we’ve stated many times, sustainable, identical sales growth is a key driver of Kroger’s financial objective to increase earnings and generate value for our shareholders.
Kroger’s original guidance for earnings per share growth in 2006 of 6% to 8% did not contemplate the need to increase legal reserves. Based on first quarter results, the Company’s guidance for earnings per share growth for 2006 remains at 6% to 8%, including the increases in legal reserves. Absent the need to increase these reserves, Kroger’s projected earnings per share growth rate would be 9% to 11% for fiscal 2006. 
Now I’ll ask Rodney to share some additional details concerning Kroger’s first quarter results. 
 
Thank you, Dave, and good morning, everyone. As Dave mentioned, Kroger reported first quarter net earnings of $306.4 million, or $0.42 per diluted share. These results include a couple of items that are not comparable to our results in the prior year. As we indicated in our guidance for 2006, we began to recognize stock option expense in the first quarter in accordance with Generally Accepted Accounting Principles. This action reduced earnings by $0.02 per diluted share. 
As a reminder, our earnings per share guidance for fiscal 2006 included stock option expense of $0.05 to $0.06 per diluted share. We now expect the full year effect for fiscal 2006 will be $0.06 per diluted share from recognizing the stock option expense.
Also, based on developments during the quarter, Kroger increased its reserves associated with legal proceedings arising from hiring practices at its Ralph’s subsidiary during the 2003 and 2004 labor disputes. The current quarter charge reduced earnings by $0.03 per diluted share and increased the amount established for this contingency.
Our reserve represents our best estimate of the Company’s exposure in connection with these legal proceedings. As this is a pending legal matter, we will not comment further on this subject. When it’s appropriate to comment, we will. 
As Dave mentioned earlier, after adjusting for the two items I just discussed, we believe Kroger had a very strong quarter. Our financial performance in the first quarter reflects the consistent approach we have taken to managing our business and consistent with the plan we have shared with you. 
We continue to balance investments in gross margin and improved customer service with operating cost reductions to provide a better shopping experience for our customers. Our strategy directly affects Kroger’s gross margin, OG&A rate and operating margin. I’ll discuss all three in the context of our first quarter results. Let’s begin with gross margin.
FIFO gross margin was 24.55% of sales, a decrease of 61 basis points compared to the first quarter of 2005. Excluding the effect of retail fuel operations, FIFO gross margins declined 9 basis points from the prior year. Kroger’s first quarter selling gross margin on non-fuel sales declined 33 basis points. 
As a reminder, selling gross margin is a term we use internally at Kroger to describe the Company’s gross margin before incurring expenses directly related to distributing and merchandising the products on our store shelves. These expenses include advertising, warehousing, transportation and shrink.
Selling gross margin is a measure of how competitively we are pricing the products we sell. Delivering value to our customers is one component of our overall strategy to improve the shopping experience. In the first quarter we were able to use improvements in shrink, advertising and warehousing expenses to help fund these additional investments and lower prices for our customers. 
OG&A declined 19 basis points to 18.17% of sales. Excluding the effect of retail fuel operations, the increase in legal reserves and the stock option expense, OG&A declined 16 basis points. Leverage from strong identical sales plus good cost control in such areas of energy usage and labor productivity helped us overcome some of the significant increases in fuel and energy related costs that many companies are facing. 
Excluding our retail fuel operations, we estimate that higher energy prices negatively affected gross margin by 30 basis points and OG&A by 4 basis points for a total negative effect of 7 basis points. This compares favorably to the 13 basis point negative effect in the fourth quarter of 2005.
Next, I would like to make a few comments about our operating margin for the first quarter. Kroger’s operating margin on a GAAP basis declined 12 basis points to 3.32% of sales. Excluding the effect of retail fuel sales, an increase in legal reserves and stock option expense, operating margin grew 32% basis points. 24 basis points came from better sales leverage over rent and depreciation expense. The gross margin and OG&A effects I just discussed explain the remainder of the improvement. 
In keeping with our strategic plan, Kroger will continue to invest savings generated from reduced cost and improved productivity to enhance our customer shopping experience through better service, product selection and value. On a quarter-by-quarter basis, however, our operating margin may fluctuate depending on the timing of both our savings and our reinvestment in our customer shopping experience. 
For fiscal 2006 we still forecast slightly improving operating margins, resulting primarily from improvements at Ralph’s. During the first quarter we saw improvements in sales and profitability at Ralph’s and expect continual improvement. This will be one of the drivers of our earnings per share growth in 2006. 
Kroger’s financial triple play strategy supports the successful execution of our customer first business strategy. During the first quarter, strong cash flow enabled Kroger to invest in our high quality asset base, reduce debt and return value to our shareholders through share buybacks and dividends. 
Capital investments totaled $449.9 million in the first quarter compared to $400.6 million a year ago. We are on track to invest approximately $1.7 billion to $1.9 billion in capital projects during fiscal year 2006 and we still anticipate total supermarket square footage growth of 1.5% to 2% before acquisitions and operational closings. 
For the first quarter, total supermarket square footage grew 1.6%, year-over-year, excluding acquisitions and operational closings. Our return on asset measures improved almost 1% on a pre-tax basis. This indication gives us confidence that we are investing our capital prudently. 
During the quarter, Kroger opened, expanded, relocated or acquired 16 supermarkets. We completed 39 remodels and closed 36 locations. Of these locations, 31 were operational closings. 16 of these stores were located in northern California, whereas we previously announced we are exiting the San Francisco and Sacramento markets under the Cala Foods Bell Markets and Ralph’s banner. 
Net total debt was $6.6 billion, a reduction of $829.3 million from a year ago, and a reduction of $2.1 billion since January 2000. Net total debt includes a reduction of $526 million to reflect temporary cash investments. Total debt was $7.2 billion, a reduction of $318 million from a year ago.
As you know, our investment grade rating is very important to us. We have steadily improved our coverage ratios in recent years, and our net total debt/EBITDA ratio in the first quarter was 1.98, the lowest since our recapitalization in 1988. Fitch Ratings recently reaffirmed our credit rating at BBB, and upgraded our outlook to stable from negative. 
During the first quarter, Kroger repurchased approximately 6.7 million shares of stock at an average price of $19.90, for a total investment of $133.5 million. Last month, we announced our Board's authorization of a new $500 million stock repurchase program, reflecting the Board's confidence in the company's strategic plan and our belief that Kroger shares represent an attractive investment. At the end of the first quarter, there are approximately $486.9 million remaining under that new authorization.
Since January 2000, Kroger has invested $3.1 billion to repurchase 162.4 million shares, or 18% of the outstanding shares, at an average price of $19.17. Kroger expects to buy back stock in 2006, in accordance with the company's financial strategy of using one-third of free cash flow for debt reduction, and two-thirds for share repurchase and cash dividend payments.
In March, Kroger announced that its Board of Directors adopted a dividend policy, and declared the payment of a quarterly dividend of $0.065 per share. Subsequently, on June 1st, Kroger paid a cash dividend to shareholders, the first such payment since our leveraged recapitalization some 18 years ago.
In addition to the financial triple play, Kroger's first quarter cash flow permitted us to make a cash contribution of $150 million to company-sponsored pension plans. This contribution completes our expected funding for fiscal 2006. Kroger's cash contribution in the year ago quarter was $88.6 million for the first quarter, and $300 million for the entire year. 
Our first quarter tax rate was 37.4%, compared to 35.9% for the prior year. The current quarter rate differs from the statutory rate primarily due to state taxes. The first quarter of 2006 rate is higher than the prior year rate because, in 2005, we reduced previously recorded tax contingency allowances, resulting from a revision in the required allowances. We expect that our tax rate for fiscal 2006 will be 37.5%, consistent with our guidance at the beginning of the year.
Now for some brief comments on labor. While we do not face the same magnitude of contract negotiations this year compared to last year, labor negotiations continue to be a challenge in the face of competitive pressures and rising pension and health-care cost. In each contract negotiation, we will work toward an agreement that meets our objectives for cost reductions or containment, while fulfilling our commitment to provide our associates with solid wages and benefits. This balance will allow Kroger to invest in our business to create new job opportunities for our existing associates and hire more people.
Now I will turn it back to Dave for some closing remarks.
 
We are very pleased with Kroger's first quarter results. This quarter gives us a solid start in fiscal 2006 towards achieving or exceeding the objectives we outlined for investors at the beginning of the year. In fact, we have already raised our identical sales and, from an operating standpoint, earnings-per-share guidance for the year to reflect our confidence in Kroger's strategic plan. We believe that Kroger's strong identical sales are primarily a result of our entire organization's effort to connect better with each and every customer, and to improve their overall shopping experience. 
We are going about that in several different ways, and it's more than just lower prices. Yes, customers tell us they want value, but they also tell us that there are other aspects of their shopping experience that are very important, most notably customer service and product selection. We are making strides in several areas that our customers notice every day, including shorter wait times at check-out lanes, full shelves with items our customers want, and improvements in the cleanliness of our stores. In each of these areas, we have seen double-digit percent improvements in our tracking measurements. 
We are pleased with the progress we are making, but there is still a lot of work to do. Our results this quarter and in the future can be tied directly to the contributions of our 290,000 associates. We appreciate their hard work and thank them for making strides in several key areas. This is a very competitive industry, and customers have a lot of choices, so we recognize that it is our associates who can and will make all the difference.
We'll now be happy to take your questions.
"
